{
  "version": "1.0.0",
  "lastUpdated": "YYYY-MM-DD",
  "projectName": "Your Project Name",
  "projectVersion": "x.y.z",
  "stories": [
    {
      "id": "US-001",
      "title": "Example User Story - User Registration",
      "persona": "New User",
      "epic": "Authentication",
      "priority": "CRITICAL",
      "status": "NOT_STARTED",
      "implementedIn": null,
      "relatedTodos": ["P1-001", "P1-002"],
      "story": "As a new user, I want to create an account so that I can access personalized features and save my preferences",
      "acceptanceCriteria": [
        "GIVEN I am on the registration page",
        "WHEN I enter valid information (email, password, confirm password)",
        "THEN I should successfully create an account",
        "AND I should receive a confirmation email",
        "AND I should be automatically logged in",
        "AND I should be redirected to the dashboard"
      ],
      "businessValue": "Enables user onboarding and personalization, foundation for user engagement and retention",
      "technicalNotes": "Implement secure password hashing, email validation, and user session management",
      "risks": [
        "Email deliverability issues could prevent account confirmation",
        "Password strength requirements may frustrate users",
        "GDPR compliance requirements for user data"
      ],
      "effort": 5,
      "dependencies": [
        "Database schema must be designed",
        "Email service must be configured",
        "Authentication system must be implemented"
      ],
      "mockups": [
        "designs/registration-form.png",
        "designs/confirmation-email-template.html"
      ],
      "testCases": [
        "Valid registration with all required fields",
        "Registration with duplicate email address",
        "Registration with weak password", 
        "Registration without email confirmation",
        "Registration form validation errors"
      ],
      "createdDate": "YYYY-MM-DD",
      "createdBy": "product-owner-name",
      "lastModified": "YYYY-MM-DD",
      "modifiedBy": "team-member-name"
    },
    {
      "id": "US-002",
      "title": "Example User Story - Data Export",
      "persona": "Power User",
      "epic": "Data Management", 
      "priority": "HIGH",
      "status": "NOT_STARTED",
      "implementedIn": null,
      "relatedTodos": ["P2-003"],
      "story": "As a power user, I want to export my data in multiple formats so that I can use it in external tools and maintain data portability",
      "acceptanceCriteria": [
        "GIVEN I am logged in and have data in the system",
        "WHEN I navigate to the export section",
        "THEN I should see available export formats (CSV, JSON, XML)",
        "AND I should be able to select date ranges for export",
        "AND I should be able to filter by data categories",
        "AND the export should complete within reasonable time",
        "AND I should receive a download link via email for large exports"
      ],
      "businessValue": "Increases user satisfaction and reduces vendor lock-in concerns, enabling data portability",
      "technicalNotes": "Implement streaming export for large datasets, queue system for background processing",
      "risks": [
        "Large exports could impact system performance",
        "Data privacy concerns with export functionality",
        "File size limitations in browser downloads"
      ],
      "effort": 8,
      "dependencies": [
        "User authentication system must be complete",
        "Data access permissions must be implemented",
        "Background job processing system needed"
      ],
      "mockups": [
        "designs/export-options-dialog.png",
        "designs/export-progress-indicator.png"
      ],
      "testCases": [
        "Export small dataset in each format",
        "Export large dataset with background processing",
        "Export with date range filtering",
        "Export with category filtering",
        "Export cancellation functionality",
        "Export with insufficient permissions"
      ],
      "createdDate": "YYYY-MM-DD",
      "createdBy": "product-owner-name",
      "lastModified": "YYYY-MM-DD", 
      "modifiedBy": "team-member-name"
    }
  ],
  "epics": {
    "Authentication": ["US-001"],
    "Data Management": ["US-002"],
    "User Interface": [],
    "Reporting": [],
    "Integration": [],
    "Performance": [],
    "Security": [],
    "Mobile": [],
    "Analytics": []
  },
  "personas": [
    {
      "name": "New User",
      "description": "First-time users who are exploring the system and learning its capabilities",
      "characteristics": [
        "Limited familiarity with the domain",
        "Needs clear guidance and intuitive interfaces",
        "Values simplicity and quick wins",
        "May abandon if onboarding is complex"
      ],
      "goals": [
        "Quickly understand system value",
        "Successfully complete initial tasks",
        "Feel confident using basic features"
      ],
      "frustrations": [
        "Complex setup processes",
        "Lack of clear next steps",
        "Too many options presented at once"
      ]
    },
    {
      "name": "Power User",
      "description": "Experienced users who use the system regularly and need advanced features",
      "characteristics": [
        "Deep domain knowledge and system familiarity", 
        "Values efficiency and powerful features",
        "Willing to learn complex workflows for productivity gains",
        "Often requests advanced functionality"
      ],
      "goals": [
        "Maximize productivity with advanced features",
        "Integrate with existing tools and workflows", 
        "Customize system to specific needs"
      ],
      "frustrations": [
        "Limited customization options",
        "Lack of bulk operations",
        "Missing integrations with other tools"
      ]
    },
    {
      "name": "Administrator", 
      "description": "Users responsible for system configuration and user management",
      "characteristics": [
        "Responsible for system security and compliance",
        "Needs visibility into system usage and health",
        "Manages multiple users and their permissions",
        "Often technical but not necessarily developers"
      ],
      "goals": [
        "Maintain system security and compliance",
        "Monitor system performance and usage",
        "Efficiently manage users and permissions",
        "Troubleshoot issues quickly"
      ],
      "frustrations": [
        "Limited visibility into system operations",
        "Complex permission management",
        "Lack of audit trails"
      ]
    }
  ],
  "metrics": {
    "totalStories": 2,
    "notStarted": 2,
    "inProgress": 0,
    "inReview": 0,
    "completed": 0,
    "blocked": 0,
    "criticalPriority": 1,
    "highPriority": 1,
    "mediumPriority": 0,
    "lowPriority": 0,
    "totalEffortPoints": 13,
    "averageEffortPerStory": 6.5,
    "storiesPerEpic": {
      "Authentication": 1,
      "Data Management": 1
    },
    "completionRate": 0.0,
    "velocityTrend": [],
    "effortDistribution": {
      "1-3": 0,
      "4-6": 1, 
      "7-10": 1,
      "10+": 0
    }
  },
  "sprintPlanning": [
    {
      "sprintNumber": 1,
      "startDate": "YYYY-MM-DD",
      "endDate": "YYYY-MM-DD", 
      "plannedStories": ["US-001"],
      "plannedEffort": 5,
      "actualEffort": null,
      "status": "PLANNED",
      "goals": [
        "Establish user authentication foundation",
        "Enable basic user onboarding flow"
      ],
      "retrospectiveNotes": null
    }
  ],
  "riskAssessment": [
    {
      "category": "User Experience",
      "risks": [
        "Complex user stories may confuse new users",
        "Insufficient user testing could lead to poor usability"
      ]
    },
    {
      "category": "Technical",
      "risks": [
        "Integration complexity between different epics",
        "Performance impact of advanced features on basic workflows"
      ]
    },
    {
      "category": "Business",
      "risks": [
        "Feature creep from power user requests",
        "Balancing simplicity for new users vs. power for advanced users"
      ]
    }
  ],
  "qualityGates": [
    {
      "name": "Story Definition Complete",
      "criteria": [
        "Acceptance criteria are testable and specific",
        "Business value is clearly articulated",
        "Technical approach is understood",
        "Dependencies are identified and tracked"
      ]
    },
    {
      "name": "Implementation Ready",
      "criteria": [
        "All dependencies are satisfied",
        "Design mockups are approved (if applicable)",
        "Technical architecture is defined",
        "Effort estimate is validated by development team"
      ]
    },
    {
      "name": "Story Complete",
      "criteria": [
        "All acceptance criteria are met and verified",
        "Code is reviewed and meets quality standards",
        "Documentation is updated",
        "User testing confirms story value is delivered"
      ]
    }
  ],
  "configuration": {
    "effortScale": {
      "1": "1-2 hours of work",
      "2": "Half day of work",
      "3": "Full day of work", 
      "5": "2-3 days of work",
      "8": "One week of work",
      "13": "Two weeks of work",
      "21": "One month of work (should be broken down)"
    },
    "priorityDefinitions": {
      "CRITICAL": "Must have for core functionality, blocks other work",
      "HIGH": "Important for user value, should be in early releases", 
      "MEDIUM": "Valuable but can be delayed if necessary",
      "LOW": "Nice to have, future enhancement"
    },
    "statusDefinitions": {
      "NOT_STARTED": "Story is defined but work has not begun",
      "IN_PROGRESS": "Development work is actively happening",
      "IN_REVIEW": "Story is complete and undergoing review/testing",
      "COMPLETED": "Story is fully implemented and delivered",